{
  "$schema": "https://json-schema.org/draft/2020-12/schema",
  "$id": "https://projectlumina.org/standards/system-physics-schema-v1.json",
  "schema_version": "1.0.0",
  "last_updated": "2026-03-20",
  "title": "System Physics Schema V1",
  "description": "JSON Schema for Project Lumina System Physics documents. Defines the structured SOP for the top-level Conversational Interface (CI) layer \u2014 the invariants, standing orders, escalation triggers, and output contract that govern the CI regardless of which domain is active. Derived from YAML source (cfg/system-physics.yaml); the compiled JSON form's SHA-256 hash is committed to the system log before operational activation.",
  "type": "object",
  "required": [
    "id",
    "version",
    "meta_authority_id",
    "conforms_to",
    "invariants",
    "standing_orders",
    "escalation_triggers",
    "ci_output_contract"
  ],
  "additionalProperties": false,
  "properties": {
    "id": {
      "type": "string",
      "pattern": "^system/[a-z0-9_-]+/[a-z0-9_-]+/v[0-9]+$",
      "description": "Globally unique system physics identifier. Format: system/{org}/{name}/v{major}"
    },
    "version": {
      "type": "string",
      "pattern": "^[0-9]+\\.[0-9]+(\\.[0-9]+)?$",
      "description": "Semantic version string (major.minor or major.minor.patch)"
    },
    "meta_authority_id": {
      "type": "string",
      "description": "ID of the Meta Authority responsible for this system physics document. Use 'root' for the top-level governance body."
    },
    "conforms_to": {
      "type": "string",
      "description": "Version of lumina-core this system-physics document targets (e.g. 'lumina-core-v1.0.0')"
    },
    "description": {
      "type": "string",
      "description": "Human-readable description of this system physics document's scope and purpose"
    },
    "system_identity": {
      "type": "object",
      "additionalProperties": false,
      "required": [
        "system_name"
      ],
      "properties": {
        "system_name": {
          "type": "string",
          "description": "Canonical platform name (e.g. 'Project Lumina'). Injected into every system prompt to prevent identity hallucination."
        },
        "description": {
          "type": "string",
          "description": "One-line description of what the system is."
        },
        "disambiguation_note": {
          "type": "string",
          "description": "Instruction the CI should follow when asked about its own identity. Prevents confusion with domain-level narrative themes."
        }
      },
      "description": "System-level identity grounding. Ensures the CI always knows its own platform name and does not hallucinate names from domain-level immersion themes."
    },
    "invariants": {
      "type": "array",
      "minItems": 1,
      "items": {
        "$ref": "#/$defs/invariant"
      },
      "description": "List of system-layer invariants. Must include at least one critical invariant. These apply unconditionally \u2014 before and regardless of which domain is active."
    },
    "standing_orders": {
      "type": "array",
      "minItems": 1,
      "items": {
        "$ref": "#/$defs/standing_order"
      },
      "description": "List of bounded automated CI responses the orchestrator may take when a system invariant is violated"
    },
    "escalation_triggers": {
      "type": "array",
      "minItems": 1,
      "items": {
        "$ref": "#/$defs/escalation_trigger"
      },
      "description": "Conditions that cause the system layer to escalate to the Meta Authority"
    },
    "ci_output_contract": {
      "type": "object",
      "required": [
        "output_mode",
        "chain_of_thought",
        "raw_json_output",
        "grounding_requirement",
        "capability_claims",
        "internal_state_disclosure"
      ],
      "additionalProperties": false,
      "description": "Structured rules governing CI output behaviour. These are the machine-readable source of truth for the human-readable rendering in specs/global-system-prompt-v1.md.",
      "properties": {
        "output_mode": {
          "type": "string",
          "enum": [
            "conversational_text"
          ],
          "description": "Primary output mode. 'conversational_text' means user-facing prose only; no structured data payloads unless explicitly overridden."
        },
        "chain_of_thought": {
          "type": "string",
          "enum": [
            "disallowed",
            "allowed_if_domain_permits"
          ],
          "description": "Whether the CI may surface internal reasoning steps to the user."
        },
        "raw_json_output": {
          "type": "string",
          "enum": [
            "only_if_explicitly_requested",
            "allowed",
            "disallowed"
          ],
          "description": "When raw JSON may appear in CI output."
        },
        "grounding_requirement": {
          "type": "string",
          "enum": [
            "must_derive_from_prompt_contract",
            "best_effort"
          ],
          "description": "How tightly CI responses must be grounded in the active prompt contract."
        },
        "capability_claims": {
          "type": "string",
          "enum": [
            "bounded_by_active_prompt_contract",
            "unrestricted"
          ],
          "description": "Whether capability claims are bounded by the active prompt contract (prevents false advertising of hidden features)."
        },
        "internal_state_disclosure": {
          "type": "string",
          "enum": [
            "prohibited_unless_domain_permits",
            "allowed"
          ],
          "description": "Whether internal confidence scores, private policy internals, or sensitive runtime state may be disclosed."
        },
        "direct_execution": {
          "type": "string",
          "enum": [
            "prohibited"
          ],
          "description": "Whether the CI may directly execute state changes. 'prohibited' means all state-changing commands must travel through the proposal-schema pipeline; the CI fills in a JSON schema form and never writes state itself."
        },
        "state_change_mechanism": {
          "type": "string",
          "enum": [
            "proposal_schema_only"
          ],
          "description": "Mechanism by which state changes must be initiated. 'proposal_schema_only' requires the CI to populate a structured JSON proposal conforming to the applicable admin command schema; no other path to state mutation exists."
        },
        "proposal_validation_requirement": {
          "type": "string",
          "enum": [
            "deterministic_tool_required",
            "domain_scoped_tool_required",
            "none"
          ],
          "description": "Whether a deterministic tool must validate the proposal before it is presented for HITL review. 'domain_scoped_tool_required' means the applicable domain tool (e.g. algebra_checker for education) must pass before the proposal leaves the domain layer."
        },
        "proposal_approval_requirement": {
          "type": "string",
          "enum": [
            "hitl_required_before_execution",
            "none"
          ],
          "description": "Whether a system-level user must approve the validated proposal via HITL (accept / reject / modify) before execution proceeds. 'hitl_required_before_execution' is the universal gate for all state changes."
        },
        "physics_file_role": {
          "type": "string",
          "enum": [
            "standing_orders_and_escalation_routes"
          ],
          "description": "Declares the functional role of physics files. 'standing_orders_and_escalation_routes' means physics files define what the CI must do when conditions are met and where to escalate when they cannot be resolved; they do not grant the CI execution authority."
        }
      }
    },
    "glossary": {
      "type": "array",
      "items": {
        "$ref": "#/$defs/glossary_entry"
      },
      "description": "Controlled vocabulary for Lumina infrastructure terms. Entries are surfaced via the glossary-intercept pipeline when admins or auditors query term definitions in the system domain."
    },
    "slm_config": {
      "$ref": "#/$defs/slm_config",
      "description": "Optional configuration for the Small Language Model (SLM) compute distribution layer. When present, enables SLM-routed handling of low-weight tasks (definitions, physics interpretation, admin command translation)."
    }
  },
  "$defs": {
    "invariant": {
      "type": "object",
      "required": [
        "id",
        "description",
        "severity"
      ],
      "additionalProperties": false,
      "if": {
        "not": {
          "required": [
            "handled_by"
          ]
        }
      },
      "then": {
        "required": [
          "check"
        ]
      },
      "properties": {
        "id": {
          "type": "string",
          "description": "Unique identifier for this invariant within the system physics document"
        },
        "description": {
          "type": "string",
          "description": "Human-readable description of the invariant"
        },
        "severity": {
          "type": "string",
          "enum": [
            "critical",
            "warning"
          ],
          "description": "critical: violation halts autonomous CI action and triggers immediate standing order or escalation; warning: triggers a standing order"
        },
        "check": {
          "type": "string",
          "description": "Predicate expression evaluated by the orchestrator. Required when handled_by is absent."
        },
        "handled_by": {
          "type": "string",
          "description": "ID of the subsystem that evaluates this invariant. When present, the orchestrator defers to the named subsystem."
        },
        "standing_order_on_violation": {
          "type": "string",
          "description": "ID of the standing order to invoke when this invariant is violated"
        },
        "signal_type": {
          "type": "string",
          "description": "Optional signal type emitted when this invariant fires"
        }
      }
    },
    "standing_order": {
      "type": "object",
      "required": [
        "id",
        "action",
        "trigger_condition",
        "max_attempts",
        "escalation_on_exhaust"
      ],
      "additionalProperties": false,
      "properties": {
        "id": {
          "type": "string",
          "description": "Unique identifier for this standing order"
        },
        "action": {
          "type": "string",
          "description": "The automated action the CI takes when this standing order is activated"
        },
        "trigger_condition": {
          "type": "string",
          "description": "Invariant ID or condition that activates this order"
        },
        "max_attempts": {
          "type": "integer",
          "minimum": 1,
          "description": "Maximum times this order may be applied per session before escalation"
        },
        "escalation_on_exhaust": {
          "type": "boolean",
          "description": "Whether to escalate to the Meta Authority when max_attempts is reached"
        },
        "description": {
          "type": "string",
          "description": "Human-readable description of what this standing order does"
        }
      }
    },
    "escalation_trigger": {
      "type": "object",
      "required": [
        "id",
        "condition",
        "target_role"
      ],
      "additionalProperties": false,
      "properties": {
        "id": {
          "type": "string"
        },
        "condition": {
          "type": "string",
          "description": "The condition that triggers escalation to the Meta Authority"
        },
        "target_role": {
          "type": "string",
          "description": "Role of the Meta Authority receiving this escalation"
        },
        "sla_minutes": {
          "type": "integer",
          "description": "SLA for acknowledgement in minutes; breach is itself a reportable event in the system log"
        }
      }
    },
    "glossary_entry": {
      "type": "object",
      "required": [
        "term",
        "definition"
      ],
      "additionalProperties": false,
      "properties": {
        "term": {
          "type": "string",
          "description": "Canonical term (lowercase). The primary lookup key."
        },
        "definition": {
          "type": "string",
          "description": "Concise, administrator-appropriate definition of the infrastructure term."
        },
        "aliases": {
          "type": "array",
          "items": {
            "type": "string"
          },
          "description": "Alternate forms an administrator or auditor might use."
        },
        "related_terms": {
          "type": "array",
          "items": {
            "type": "string"
          },
          "description": "Other glossary terms to surface alongside this definition."
        },
        "example_in_context": {
          "type": "string",
          "description": "A concrete example using the term in a Lumina operational context."
        }
      }
    },
    "slm_config": {
      "type": "object",
      "additionalProperties": false,
      "required": [
        "enabled"
      ],
      "description": "Configuration for the Small Language Model compute distribution layer.",
      "properties": {
        "enabled": {
          "type": "boolean",
          "description": "Whether SLM routing is active. When false, all tasks route to LLM or deterministic templates."
        },
        "default_provider": {
          "type": "string",
          "enum": [
            "local",
            "openai",
            "anthropic"
          ],
          "description": "Default SLM provider. 'local' uses an Ollama-compatible endpoint (recommended); cloud providers as opt-in."
        },
        "weight_boundary": {
          "type": "string",
          "enum": [
            "definitions_only",
            "definitions_and_physics",
            "full"
          ],
          "description": "How much work the SLM handles. 'definitions_only': glossary lookups. 'definitions_and_physics': plus physics interpretation and context compression. 'full': plus admin command translation."
        },
        "fallback_on_unavailable": {
          "type": "string",
          "enum": [
            "deterministic",
            "llm"
          ],
          "description": "Behaviour when the SLM is unreachable. 'deterministic' uses template rendering (recommended \u2014 preserves compute separation). 'llm' escalates to the large model."
        },
        "local_endpoint": {
          "type": "string",
          "description": "URI of the local SLM endpoint (e.g. http://localhost:11434 for Ollama)."
        },
        "admin_command_translation": {
          "type": "boolean",
          "description": "Whether the SLM may parse natural-language admin instructions into structured commands. Requires 'full' weight_boundary."
        },
        "timeout_seconds": {
          "type": "number",
          "minimum": 5,
          "description": "HTTP timeout in seconds for local SLM calls. Higher values accommodate slower hardware or larger models. Override at runtime via LUMINA_SLM_TIMEOUT."
        }
      }
    }
  }
}
